{"$schema":"https://json-schema.org/draft/2020-12/schema","$id":"checkpoint-5a-qa.schema.json","type":"object","additionalProperties":false,"required":["schema_version","qa_id","aggregate_status","owning_check_refs","status_dimensions"],"properties":{"schema_version":{"const":"1.0.0"},"qa_id":{"const":"CP5A-QA-001"},"aggregate_status":{"enum":["pass","fail","block"]},"owning_check_refs":{"type":"array","minItems":1,"uniqueItems":true,"items":{"type":"string","pattern":"^CP5A-[A-Z0-9-]+$"}},"status_dimensions":{"type":"object","additionalProperties":false,"required":["scientific_svg_language","static_svg_validator","semantic_governance","cjk_static_text","resource_policy","canonicalization_hash","synthetic_corpus","native_capability_registry","static_figure_critic","production_figure_rendering","render_critic","a01_a18_calibration","drawingml_compiler","template_reconstruction","acceptance_deck","production_group_meeting_ready"],"properties":{"scientific_svg_language":{"enum":["pass","fail","block"]},"static_svg_validator":{"enum":["pass","fail","block"]},"semantic_governance":{"enum":["pass","fail","block"]},"cjk_static_text":{"enum":["pass","fail","block"]},"resource_policy":{"enum":["pass","fail","block"]},"canonicalization_hash":{"enum":["pass","fail","block"]},"synthetic_corpus":{"enum":["pass","fail","block"]},"native_capability_registry":{"const":"not_run"},"static_figure_critic":{"const":"not_run"},"production_figure_rendering":{"const":"not_run"},"render_critic":{"const":"not_run"},"a01_a18_calibration":{"const":"not_run"},"drawingml_compiler":{"const":"not_run"},"template_reconstruction":{"const":"not_run"},"acceptance_deck":{"const":"not_run"},"production_group_meeting_ready":{"const":false}}}}}
